<?xml version="1.0" encoding="UTF-8"?>
<!--
   Phon - An open source tool for research in phonology.
   Copyright (C) 2018 Gregory Hedlund & Yvan Rose
    
   Licensed under the Apache License, Version 2.0 (the "License");
   you may not use this file except in compliance with the License.
   You may obtain a copy of the License at

       http://www.apache.org/licenses/LICENSE-2.0

   Unless required by applicable law or agreed to in writing, software
   distributed under the License is distributed on an "AS IS" BASIS,
   WITHOUT WARRANTIES OR CONDITIONS OF ANY KIND, either express or implied.
   See the License for the specific language governing permissions and
   limitations under the License.
-->
<!--
    This file specifies the xml file format for Phon's feature matrix.
    Feature sets are used in many of the internal algorithms and searches
    in Phon.
    
    For more information on creating custom feature sets for use in searches,
    see http://phon.ling.mun.ca/phontrac/wiki/search/customfeatures
-->
<!-- 
    2012-01-11 (gjh): created file
-->
<xs:schema xmlns:xs="http://www.w3.org/2001/XMLSchema"
    xmlns="https://phon.ca/ns/features"
    targetNamespace="https://phon.ca/ns/features">
    
    <!--
        Our root element
    -->
    <xs:element name="feature_matrix" type="featureMatrixType">
        <!--
            Setup constraints for references to
            declared features
        -->
        <xs:key name="feature_key">
            <xs:selector xpath="feature"></xs:selector>
            <xs:field xpath="@name"></xs:field>
        </xs:key>
        
        <xs:keyref refer="feature_key" name="feature_key_ref">
            <xs:selector xpath="."></xs:selector>
            <xs:field xpath="feature_set"></xs:field>
        </xs:keyref>
        
        <xs:keyref refer="feature_key" name="named_feature_key_ref">
            <xs:selector xpath="."></xs:selector>
            <xs:field xpath="named_feature_set"></xs:field>
        </xs:keyref>
        
        <!--
            Don't allow duplicate unicode entries
        -->
        <xs:unique name="feature_set_key">
            <xs:selector xpath=".//feature_set"></xs:selector>
            <xs:field xpath="@char"></xs:field>
        </xs:unique>
        
        <xs:unique name="named_feature_set_key">
            <xs:selector xpath=".//named_feature_set"></xs:selector>
            <xs:field xpath="@name"></xs:field>
        </xs:unique>
    </xs:element>
    
    <!--
        JAXB requires elements we wish to parse in fragments 
        to be declared at the root level of the schema
    -->
    <xs:element name="feature" type="featureType"/>
    <xs:element name="named_feature_set" type="namedFeatureSetType"/>
    <xs:element name="feature_set" type="featureSetType"/>
    <xs:element name="features" type="xs:IDREFS"/>
    <xs:element name="name" type="nonEmptyString"/>
    <xs:element name="synonym" type="nonEmptyString"/>
    <xs:element name="primary_family" type="family"/>
    <xs:element name="secondary_family" type="family"/>
    
    <xs:complexType name="featureMatrixType" mixed="false">
        <xs:sequence>
            <xs:element ref="feature" minOccurs="0" maxOccurs="unbounded"/>
            <xs:element ref="named_feature_set" minOccurs="0" maxOccurs="unbounded"/>
            <xs:element ref="feature_set" minOccurs="0" maxOccurs="unbounded"/>
        </xs:sequence>
    </xs:complexType>
    
    <xs:complexType name="namedFeatureSetType" mixed="false">
        <xs:simpleContent>
            <xs:extension base="xs:IDREFS">
                <xs:attribute name="name" type="nonEmptyString" use="required"/>
            </xs:extension>
        </xs:simpleContent>
    </xs:complexType>
    
    <xs:complexType name="featureSetType" mixed="false">
        <xs:simpleContent>
            <xs:extension base="xs:IDREFS">
                <xs:attribute name="char" type="singleChar" use="required"/>
            </xs:extension>
        </xs:simpleContent>
    </xs:complexType>
    
    <xs:complexType name="featureType" mixed="false">
        <xs:sequence>
            <xs:element ref="synonym" minOccurs="0" maxOccurs="unbounded"/>
            <xs:element ref="primary_family" minOccurs="0" maxOccurs="1"/>
            <xs:element ref="secondary_family" minOccurs="0" maxOccurs="1"/>
        </xs:sequence>
        
        <xs:attribute name="name" type="xs:ID" use="required"/>
    </xs:complexType>
    
    <xs:simpleType name="family">
        <xs:restriction base="xs:string">
            <xs:enumeration value="place"/>
            <xs:enumeration value="manner"/>
            <xs:enumeration value="height"/>
            <xs:enumeration value="tongue root"/>
            <xs:enumeration value="backness"/>
            <xs:enumeration value="diacritic"/>
            <xs:enumeration value="labial"/>
            <xs:enumeration value="dorsal"/>
            <xs:enumeration value="coronal"/>
            <xs:enumeration value="voicing"/>
            <xs:enumeration value="continuancy"/>
            <xs:enumeration value="nasality"/>
            <xs:enumeration value="stridency"/>
            <xs:enumeration value="guttural"/>
        </xs:restriction>
    </xs:simpleType>
    
    <xs:simpleType name="singleChar">
        <xs:restriction base="xs:string">
            <xs:length value="1"/>
        </xs:restriction>
    </xs:simpleType>
    
    <xs:simpleType name="nonEmptyString">
        <xs:restriction base="xs:string">
            <xs:minLength value="1"/>
        </xs:restriction>
    </xs:simpleType>
    
</xs:schema>