<?xml version="1.0" encoding="UTF-8"?>
<feature_matrix xmlns="https://phon.ca/ns/features"
   xmlns:xsi="http://www.w3.org/2001/XMLSchema-instance"
   xsi:schemaLocation="https://phon.ca/ns/features ../../../../xml/xsd/features.xsd">
	<feature name="null"/>
	<feature name="diacritic"/>
	<feature name="unintelligible"/>
	<feature name="unreleased">
		<primary_family>diacritic</primary_family>
	</feature>
	<feature name="consonant">
		<synonym>c</synonym>
	</feature>
	<feature name="vowel">
		<synonym>v</synonym>
	</feature>
	<feature name="glide">
		<synonym>g</synonym>
	</feature>
	<feature name="cover"/>
	<feature name="schwa">
		<synonym>sch</synonym>
	</feature>
	<feature name="labial">
		<synonym>lab</synonym>
		<primary_family>place</primary_family>
		<secondary_family>labial</secondary_family>
	</feature>
	<feature name="bilabial">
		<synonym>bil</synonym>
		<primary_family>place</primary_family>
		<secondary_family>labial</secondary_family>
	</feature>
	<feature name="round">
		<primary_family>place</primary_family>
		<secondary_family>labial</secondary_family>
	</feature>
	<feature name="palatal">
		<synonym>pal</synonym>
		<primary_family>place</primary_family>
		<secondary_family>dorsal</secondary_family>
	</feature>
	<feature name="dorsal">
		<synonym>dor</synonym>
		<primary_family>place</primary_family>
		<secondary_family>dorsal</secondary_family>
	</feature>
	<feature name="velar">
		<synonym>vel</synonym>
		<primary_family>place</primary_family>
		<secondary_family>dorsal</secondary_family>
	</feature>
	<feature name="uvular">
		<synonym>uvu</synonym>
		<primary_family>place</primary_family>
		<secondary_family>dorsal</secondary_family>
	</feature>
	<feature name="guttural">
		<synonym>gut</synonym>
		<primary_family>place</primary_family>
		<secondary_family>guttural</secondary_family>
	</feature>
	<feature name="pharyngeal">
		<synonym>pha</synonym>
		<primary_family>place</primary_family>
		<secondary_family>guttural</secondary_family>
	</feature>
	<feature name="laryngeal">
		<synonym>lar</synonym>
		<synonym>glottal</synonym>
		<primary_family>place</primary_family>
		<secondary_family>guttural</secondary_family>
	</feature>
	<feature name="epiglottal">
		<synonym>epi</synonym>
		<primary_family>place</primary_family>
		<secondary_family>guttural</secondary_family>
	</feature>
	<feature name="dental">
		<synonym>den</synonym>
		<primary_family>place</primary_family>
		<secondary_family>coronal</secondary_family>
	</feature>
	<feature name="apical">
		<synonym>api</synonym>
		<primary_family>place</primary_family>
		<secondary_family>coronal</secondary_family>
	</feature>
	<feature name="laminal">
		<synonym>lam</synonym>
		<primary_family>place</primary_family>
		<secondary_family>coronal</secondary_family>
	</feature>
	<feature name="coronal">
		<synonym>cor</synonym>
		<primary_family>place</primary_family>
		<secondary_family>coronal</secondary_family>
	</feature>
	<feature name="lingual">
		<synonym>lin</synonym>
		<primary_family>place</primary_family>
	</feature>
	<feature name="anterior">
		<synonym>ant</synonym>
		<primary_family>place</primary_family>
		<secondary_family>coronal</secondary_family>
	</feature>
	<feature name="posterior">
		<synonym>pos</synonym>
		<primary_family>place</primary_family>
		<secondary_family>coronal</secondary_family>
	</feature>
	<feature name="alveolar">
		<synonym>alv</synonym>
		<primary_family>place</primary_family>
		<secondary_family>coronal</secondary_family>
	</feature>
	<feature name="alveopalatal">
		<synonym>alp</synonym>
		<synonym>postalveolar</synonym>
		<primary_family>place</primary_family>
		<secondary_family>coronal</secondary_family>
	</feature>
	<feature name="retroflex">
		<primary_family>place</primary_family>
		<secondary_family>coronal</secondary_family>
	</feature>
	<feature name="distributed">
		<synonym>dis</synonym>
		<primary_family>place</primary_family>
		<secondary_family>coronal</secondary_family>
	</feature>
	<feature name="voiceless">
		<synonym>vcl</synonym>
		<primary_family>manner</primary_family>
		<secondary_family>voicing</secondary_family>
	</feature>
	<feature name="voiced">
		<synonym>vcd</synonym>
		<primary_family>manner</primary_family>
		<secondary_family>voicing</secondary_family>
	</feature>
	<feature name="aspirated">
		<primary_family>manner</primary_family>
		<secondary_family>voicing</secondary_family>
	</feature>
	<feature name="weaklyaspirated">
		<primary_family>manner</primary_family>
		<secondary_family>voicing</secondary_family>
	</feature>
	<feature name="unaspirated">
		<primary_family>manner</primary_family>
		<secondary_family>voicing</secondary_family>
	</feature>
	<feature name="approximant">
		<synonym>app</synonym>
		<primary_family>manner</primary_family>
		<secondary_family>continuancy</secondary_family>
	</feature>
	<feature name="liquid">
		<synonym>liq</synonym>
		<primary_family>manner</primary_family>
		<secondary_family>continuancy</secondary_family>
	</feature>
	<feature name="lateral">
		<synonym>lat</synonym>
		<primary_family>manner</primary_family>
		<secondary_family>continuancy</secondary_family>
	</feature>
	<feature name="rhotic">
		<synonym>rho</synonym>
		<primary_family>manner</primary_family>
		<secondary_family>continuancy</secondary_family>
	</feature>
	<feature name="stop">
		<synonym>plosive</synonym>
		<primary_family>manner</primary_family>
		<secondary_family>continuancy</secondary_family>
	</feature>
	<feature name="continuant">
		<synonym>cnt</synonym>
		<primary_family>manner</primary_family>
		<secondary_family>continuancy</secondary_family>
	</feature>
	<feature name="obstruent">
		<synonym>obs</synonym>
		<primary_family>manner</primary_family>
		<secondary_family>continuancy</secondary_family>
	</feature>
	<feature name="sonorant">
		<synonym>son</synonym>
		<primary_family>manner</primary_family>
		<secondary_family>continuancy</secondary_family>
	</feature>
	<feature name="fricative">
		<synonym>fri</synonym>
		<primary_family>manner</primary_family>
		<secondary_family>continuancy</secondary_family>
	</feature>
	<feature name="affricate">
		<synonym>aff</synonym>
		<synonym>delayedrelease</synonym>
		<primary_family>manner</primary_family>
		<secondary_family>continuancy</secondary_family>
	</feature>
	<feature name="click">
		<primary_family>manner</primary_family>
		<secondary_family>continuancy</secondary_family>
	</feature>
	<feature name="implosive">
		<primary_family>manner</primary_family>
		<secondary_family>continuancy</secondary_family>
	</feature>
	<feature name="flap">
		<synonym>tap</synonym>
		<primary_family>manner</primary_family>
		<secondary_family>continuancy</secondary_family>
	</feature>
	<feature name="trill">
		<primary_family>manner</primary_family>
		<secondary_family>continuancy</secondary_family>
	</feature>
	<feature name="ejective">
		<primary_family>manner</primary_family>
		<secondary_family>continuancy</secondary_family>
	</feature>
	<feature name="nasal">
		<synonym>nas</synonym>
		<primary_family>manner</primary_family>
		<secondary_family>nasality</secondary_family>
	</feature>
	<feature name="prenasalized">
		<primary_family>manner</primary_family>
		<secondary_family>nasality</secondary_family>
	</feature>
	<feature name="strident">
		<synonym>str</synonym>
		<primary_family>manner</primary_family>
		<secondary_family>stridency</secondary_family>
	</feature>
	<feature name="low">
		<primary_family>height</primary_family>
	</feature>
	<feature name="mid">
		<primary_family>height</primary_family>
	</feature>
	<feature name="high">
		<primary_family>height</primary_family>
	</feature>
	<feature name="tense">
		<primary_family>tongue root</primary_family>
	</feature>
	<feature name="atr">
		<primary_family>tongue root</primary_family>
	</feature>
	<feature name="rtr">
		<primary_family>tongue root</primary_family>
	</feature>
	<feature name="lax">
		<primary_family>tongue root</primary_family>
	</feature>
	<feature name="front">
		<primary_family>backness</primary_family>
	</feature>
	<feature name="central">
		<primary_family>backness</primary_family>
	</feature>
	<feature name="back">
		<primary_family>backness</primary_family>
	</feature>
	<feature name="syllabic">
		<synonym>syl</synonym>
		<primary_family>diacritic</primary_family>
	</feature>
	<feature name="nonsyllabic">
		<primary_family>diacritic</primary_family>
	</feature>
	<feature name="advanced">
		<primary_family>diacritic</primary_family>
	</feature>
	<feature name="retracted">
		<primary_family>diacritic</primary_family>
	</feature>
	<feature name="lowered">
		<primary_family>diacritic</primary_family>
	</feature>
	<feature name="raised">
		<primary_family>diacritic</primary_family>
	</feature>
	<feature name="fronted">
		<primary_family>diacritic</primary_family>
	</feature>
	<feature name="backed">
		<primary_family>diacritic</primary_family>
	</feature>
	<feature name="morerounded">
		<primary_family>diacritic</primary_family>
	</feature>
	<feature name="lessrounded">
		<primary_family>diacritic</primary_family>
	</feature>
	<feature name="long">
		<primary_family>diacritic</primary_family>
	</feature>
	<feature name="halflong">
		<primary_family>diacritic</primary_family>
	</feature>
	<feature name="extrashort">
		<primary_family>diacritic</primary_family>
	</feature>
	<feature name="breathyvoiced">
		<primary_family>diacritic</primary_family>
	</feature>
	<feature name="creakyvoiced">
		<primary_family>diacritic</primary_family>
	</feature>
	<feature name="prstress">
		<synonym>1</synonym>
		<primary_family>diacritic</primary_family>
	</feature>
	<feature name="secstress">
		<synonym>2</synonym>
		<primary_family>diacritic</primary_family>
	</feature>
	<feature name="toneglobalrise">
		<primary_family>diacritic</primary_family>
	</feature>
	<feature name="tonedownstep">
		<primary_family>diacritic</primary_family>
	</feature>
	<feature name="tonefalling">
		<primary_family>diacritic</primary_family>
	</feature>